[
  {
    "kind": "token_event",
    "tool": "scripts.identity",
    "tenant_id": "76b87c33-6178-4ff9-94a7-164792c8e4c6",
    "borrowed_client_id": "14d82eec-204b-4c2f-b7e8-296a70dab67e",
    "actor_upn": "meganb@cloudharbor-demo.com",
    "started_at_utc": "2026-06-16T12:33:29Z",
    "completed_at_utc": "2026-06-16T12:33:30Z",
    "request": {
      "method": "POST",
      "url": "https://login.microsoftonline.com/76b87c33-6178-4ff9-94a7-164792c8e4c6/oauth2/v2.0/token",
      "headers": {
        "Content-Type": "application/x-www-form-urlencoded"
      },
      "flow": "silent",
      "scopes": [
        "https://graph.microsoft.com/.default"
      ]
    },
    "response": {
      "status_code": 200,
      "aadsts_code": null,
      "correlation_id": null,
      "persistence_kind": "encrypted",
      "cache_path": "<redacted>",
      "flow": "silent"
    },
    "outcome": "success",
    "run_id": "R008",
    "schema_version": "0.5",
    "entry_id": "15b83a8b-edf7-42fa-aea6-fee0a3eef824",
    "technique": {
      "id": "T1550.001",
      "name": "Application Access Token (refresh-token reuse)"
    }
  },
  {
    "kind": "graph_call",
    "tool": "tool_dfi_health",
    "tenant_id": "76b87c33-6178-4ff9-94a7-164792c8e4c6",
    "borrowed_client_id": "14d82eec-204b-4c2f-b7e8-296a70dab67e",
    "actor_upn": "meganb@cloudharbor-demo.com",
    "started_at_utc": "2026-06-16T12:33:29Z",
    "completed_at_utc": "2026-06-16T12:33:33Z",
    "request": {
      "method": "GET",
      "url": "https://graph.microsoft.com/v1.0/security/identities/sensors?$top=100",
      "headers": {
        "User-Agent": "rejewski-tool-dfi-health/0.1 (+https://github.com/Cloud-Harbor-Consulting-LLC/rejewski)",
        "Content-Type": "application/json"
      }
    },
    "response": {
      "status_code": 200,
      "page_count": 1,
      "row_count": 2,
      "row_cap": 1000,
      "row_cap_hit": false,
      "retry_count": 0
    },
    "outcome": "success",
    "run_id": "R008",
    "schema_version": "0.5",
    "entry_id": "faacba2e-d563-4192-94ab-93b327d4ca67",
    "technique": {
      "id": "T1518.001",
      "name": "Software Discovery: Security Software Discovery"
    }
  },
  {
    "kind": "token_event",
    "tool": "scripts.identity",
    "tenant_id": "76b87c33-6178-4ff9-94a7-164792c8e4c6",
    "borrowed_client_id": "14d82eec-204b-4c2f-b7e8-296a70dab67e",
    "actor_upn": "meganb@cloudharbor-demo.com",
    "started_at_utc": "2026-06-16T12:33:38Z",
    "completed_at_utc": "2026-06-16T12:33:39Z",
    "request": {
      "method": "POST",
      "url": "https://login.microsoftonline.com/76b87c33-6178-4ff9-94a7-164792c8e4c6/oauth2/v2.0/token",
      "headers": {
        "Content-Type": "application/x-www-form-urlencoded"
      },
      "flow": "silent",
      "scopes": [
        "https://graph.microsoft.com/.default"
      ]
    },
    "response": {
      "status_code": 200,
      "aadsts_code": null,
      "correlation_id": null,
      "persistence_kind": "encrypted",
      "cache_path": "<redacted>",
      "flow": "silent"
    },
    "outcome": "success",
    "run_id": "R008",
    "schema_version": "0.5",
    "entry_id": "32870947-4c97-4b68-abde-7c32e5f920e4",
    "technique": {
      "id": "T1550.001",
      "name": "Application Access Token (refresh-token reuse)"
    }
  },
  {
    "kind": "graph_call",
    "tool": "tool_intune_devices",
    "tenant_id": "76b87c33-6178-4ff9-94a7-164792c8e4c6",
    "borrowed_client_id": "14d82eec-204b-4c2f-b7e8-296a70dab67e",
    "actor_upn": "meganb@cloudharbor-demo.com",
    "started_at_utc": "2026-06-16T12:33:38Z",
    "completed_at_utc": "2026-06-16T12:33:39Z",
    "request": {
      "method": "GET",
      "url": "https://graph.microsoft.com/v1.0/deviceManagement/managedDevices?$select=id,deviceName,managedDeviceOwnerType,operatingSystem,osVersion,complianceState,managementState,lastSyncDateTime,enrolledDateTime,azureADDeviceId,userPrincipalName,userDisplayName,manufacturer,model,isEncrypted&$top=100",
      "headers": {
        "User-Agent": "rejewski-tool-intune-devices/0.1 (+https://github.com/Cloud-Harbor-Consulting-LLC/rejewski)",
        "Content-Type": "application/json"
      }
    },
    "response": {
      "status_code": 200,
      "page_count": 1,
      "row_count": 1,
      "row_cap": 1000,
      "row_cap_hit": false,
      "retry_count": 0
    },
    "outcome": "success",
    "run_id": "R008",
    "schema_version": "0.5",
    "entry_id": "67568325-123c-463e-8883-cd32055d90bf",
    "technique": {
      "id": "T1082",
      "name": "System Information Discovery"
    }
  }
]
