[
  {
    "kind": "token_event",
    "tool": "scripts.identity",
    "tenant_id": "76b87c33-6178-4ff9-94a7-164792c8e4c6",
    "borrowed_client_id": "14d82eec-204b-4c2f-b7e8-296a70dab67e",
    "actor_upn": "meganb@cloudharbor-demo.com",
    "started_at_utc": "2026-08-29T21:21:19Z",
    "completed_at_utc": "2026-08-29T21:21:20Z",
    "request": {
      "method": "POST",
      "url": "https://login.microsoftonline.com/76b87c33-6178-4ff9-94a7-164792c8e4c6/oauth2/v2.0/token",
      "headers": {
        "Content-Type": "application/x-www-form-urlencoded"
      },
      "flow": "silent",
      "scopes": [
        "https://graph.microsoft.com/.default"
      ]
    },
    "response": {
      "status_code": 200,
      "aadsts_code": null,
      "correlation_id": null,
      "persistence_kind": "encrypted",
      "cache_path": "<redacted>",
      "flow": "silent"
    },
    "outcome": "success",
    "run_id": "R012",
    "schema_version": "0.5",
    "entry_id": "83fbfa75-2e5a-4d08-9507-ea48e26eedee",
    "technique": {
      "id": "T1550.001",
      "name": "Application Access Token (refresh-token reuse)"
    }
  },
  {
    "kind": "graph_call",
    "tool": "tool_list_users",
    "tenant_id": "76b87c33-6178-4ff9-94a7-164792c8e4c6",
    "borrowed_client_id": "14d82eec-204b-4c2f-b7e8-296a70dab67e",
    "actor_upn": "meganb@cloudharbor-demo.com",
    "started_at_utc": "2026-08-29T21:21:19Z",
    "completed_at_utc": "2026-08-29T21:21:20Z",
    "request": {
      "method": "GET",
      "url": "https://graph.microsoft.com/v1.0/users?$select=id,displayName,userPrincipalName,mail,jobTitle,department,accountEnabled&$top=999",
      "headers": {
        "User-Agent": "rejewski-tool-list-users/0.2 (+https://github.com/Cloud-Harbor-Consulting-LLC/rejewski)",
        "Content-Type": "application/json"
      }
    },
    "response": {
      "status_code": 200,
      "page_count": 1,
      "row_count": 9,
      "row_cap": 1000,
      "row_cap_hit": false,
      "retry_count": 0
    },
    "outcome": "success",
    "run_id": "R012",
    "schema_version": "0.5",
    "entry_id": "e6e6630d-7cc7-40f9-a722-0f46a0a78b3e",
    "technique": {
      "id": "T1087.004",
      "name": "Account Discovery: Cloud Account"
    }
  },
  {
    "kind": "token_event",
    "tool": "scripts.identity",
    "tenant_id": "76b87c33-6178-4ff9-94a7-164792c8e4c6",
    "borrowed_client_id": "14d82eec-204b-4c2f-b7e8-296a70dab67e",
    "actor_upn": "meganb@cloudharbor-demo.com",
    "started_at_utc": "2026-08-29T21:21:31Z",
    "completed_at_utc": "2026-08-29T21:21:32Z",
    "request": {
      "method": "POST",
      "url": "https://login.microsoftonline.com/76b87c33-6178-4ff9-94a7-164792c8e4c6/oauth2/v2.0/token",
      "headers": {
        "Content-Type": "application/x-www-form-urlencoded"
      },
      "flow": "silent",
      "scopes": [
        "https://graph.microsoft.com/.default"
      ]
    },
    "response": {
      "status_code": 200,
      "aadsts_code": null,
      "correlation_id": null,
      "persistence_kind": "encrypted",
      "cache_path": "<redacted>",
      "flow": "silent"
    },
    "outcome": "success",
    "run_id": "R012",
    "schema_version": "0.5",
    "entry_id": "15d7116f-d557-4e9f-8560-14524b48adc7",
    "technique": {
      "id": "T1550.001",
      "name": "Application Access Token (refresh-token reuse)"
    }
  },
  {
    "kind": "graph_call",
    "tool": "tool_list_role_assignments",
    "tenant_id": "76b87c33-6178-4ff9-94a7-164792c8e4c6",
    "borrowed_client_id": "14d82eec-204b-4c2f-b7e8-296a70dab67e",
    "actor_upn": "meganb@cloudharbor-demo.com",
    "started_at_utc": "2026-08-29T21:21:31Z",
    "completed_at_utc": "2026-08-29T21:21:33Z",
    "request": {
      "method": "GET",
      "url": "https://graph.microsoft.com/v1.0/roleManagement/directory/roleAssignments?$select=id,principalId,roleDefinitionId,directoryScopeId&$expand=principal&$top=100",
      "headers": {
        "User-Agent": "rejewski-tool-list-role-assignments/0.1 (+https://github.com/Cloud-Harbor-Consulting-LLC/rejewski)",
        "Content-Type": "application/json"
      }
    },
    "response": {
      "status_code": 200,
      "page_count": 2,
      "row_count": 14,
      "row_cap": 1000,
      "row_cap_hit": false,
      "retry_count": 0
    },
    "outcome": "success",
    "run_id": "R012",
    "schema_version": "0.5",
    "entry_id": "75e7a9eb-f2ea-4c2c-b070-bbfe6b74fa93",
    "technique": {
      "id": "T1087.004",
      "name": "Account Discovery: Cloud Account"
    }
  },
  {
    "kind": "graph_call",
    "tool": "tool_list_service_principals",
    "tenant_id": "76b87c33-6178-4ff9-94a7-164792c8e4c6",
    "borrowed_client_id": "14d82eec-204b-4c2f-b7e8-296a70dab67e",
    "actor_upn": "meganb@cloudharbor-demo.com",
    "started_at_utc": "2026-08-29T21:21:48Z",
    "completed_at_utc": "2026-08-29T21:21:52Z",
    "request": {
      "method": "GET",
      "url": "https://graph.microsoft.com/v1.0/servicePrincipals?$select=id,appId,displayName,accountEnabled,servicePrincipalType,signInAudience,appOwnerOrganizationId,tags,homepage&$top=100",
      "headers": {
        "User-Agent": "rejewski-tool-list-service-principals/0.1 (+https://github.com/Cloud-Harbor-Consulting-LLC/rejewski)",
        "Content-Type": "application/json"
      }
    },
    "response": {
      "status_code": 200,
      "page_count": 5,
      "row_count": 419,
      "row_cap": 1000,
      "row_cap_hit": false,
      "retry_count": 0
    },
    "outcome": "success",
    "run_id": "R012",
    "schema_version": "0.5",
    "entry_id": "1d9c39b3-b8aa-4735-9dbd-5d30a99402d3",
    "technique": {
      "id": "T1087.004",
      "name": "Account Discovery: Cloud Account"
    }
  },
  {
    "kind": "token_event",
    "tool": "scripts.identity",
    "tenant_id": "76b87c33-6178-4ff9-94a7-164792c8e4c6",
    "borrowed_client_id": "14d82eec-204b-4c2f-b7e8-296a70dab67e",
    "actor_upn": "meganb@cloudharbor-demo.com",
    "started_at_utc": "2026-08-29T21:21:48Z",
    "completed_at_utc": "2026-08-29T21:21:49Z",
    "request": {
      "method": "POST",
      "url": "https://login.microsoftonline.com/76b87c33-6178-4ff9-94a7-164792c8e4c6/oauth2/v2.0/token",
      "headers": {
        "Content-Type": "application/x-www-form-urlencoded"
      },
      "flow": "silent",
      "scopes": [
        "https://graph.microsoft.com/.default"
      ]
    },
    "response": {
      "status_code": 200,
      "aadsts_code": null,
      "correlation_id": null,
      "persistence_kind": "encrypted",
      "cache_path": "<redacted>",
      "flow": "silent"
    },
    "outcome": "success",
    "run_id": "R012",
    "schema_version": "0.5",
    "entry_id": "ee3d52fe-230b-4b68-8190-9559c1979d73",
    "technique": {
      "id": "T1550.001",
      "name": "Application Access Token (refresh-token reuse)"
    }
  }
]
